<?xml version="1.0" encoding="UTF-8"?>
<dmi2:BulkDataCopy xmlns:ns3="http://docs.oasis-open.org/wss/2004/01/oasis-200401-wss-wssecurity-secext-1.0.xsd"
 xmlns:ns4="http://www.w3.org/2005/08/addressing"
 xmlns:ns5="http://docs.oasis-open.org/wss/2004/01/oasis-200401-wss-wssecurity-utility-1.0.xsd"
 xmlns:dmi2="http://schemas.dataminx.org/dts/2009/07/dmi2-common"
 xmlns:digsig="http://www.w3.org/2000/09/xmldsig#"
 xmlns:xsi="http://www.w3.org/2001/XMLSchema-instance"
 xsi:schemaLocation="http://schemas.dataminx.org/dts/2009/07/dmi2-common file:/home/djm76/programming/java/dts/dtsproject/dts-schema/src/main/resources/dmi2-common.xsd">
    
    <dmi2:DataCopy>
        <dmi2:Source>
            <dmi2:Data ProtocolUri="http://www.oxygenxml.com/">
                <dmi2:DataUrl>http://www.oxygenxml.com/</dmi2:DataUrl>
                <dmi2:IrodsURIProperties>
                    <dmi2:IrodsZone>IrodsZone0</dmi2:IrodsZone>
                </dmi2:IrodsURIProperties>
                <dmi2:Credentials>             
                </dmi2:Credentials>             
            </dmi2:Data>
            <dmi2:Data ProtocolUri="http://www.oxygenxml.com/">
                <dmi2:DataUrl>http://www.oxygenxml.com/</dmi2:DataUrl>
                <dmi2:IrodsURIProperties>
                    <dmi2:IrodsZone>IrodsZone1</dmi2:IrodsZone>
                </dmi2:IrodsURIProperties>
                <dmi2:Credentials>                  
                </dmi2:Credentials>             
            </dmi2:Data>          
        </dmi2:Source>
        
        <dmi2:Sink>
            <dmi2:Data ProtocolUri="http://www.oxygenxml.com/">
                <dmi2:DataUrl>http://www.oxygenxml.com/</dmi2:DataUrl>
                <dmi2:GridFtpURIProperties>
                </dmi2:GridFtpURIProperties>
                <dmi2:Credentials>
                   
                </dmi2:Credentials>
             
            </dmi2:Data>
            <dmi2:Data ProtocolUri="http://www.oxygenxml.com/">
                <dmi2:DataUrl>http://www.oxygenxml.com/</dmi2:DataUrl>
                <dmi2:SrbURIProperties>
                    <dmi2:MdasDomainHome>MdasDomainHome0</dmi2:MdasDomainHome>
                    <dmi2:MdasCollectionHome>MdasCollectionHome0</dmi2:MdasCollectionHome>
                </dmi2:SrbURIProperties>
                <dmi2:Credentials>
                 
                </dmi2:Credentials>
               
            </dmi2:Data>
           
        </dmi2:Sink>
       
    </dmi2:DataCopy>
    
    
    
    <dmi2:DataCopy>
        <dmi2:Source>
            <dmi2:Data ProtocolUri="http://www.oxygenxml.com/">
                <dmi2:DataUrl>http://www.oxygenxml.com/</dmi2:DataUrl>
                <dmi2:GridFtpURIProperties>
                </dmi2:GridFtpURIProperties>
                <dmi2:Credentials>
                 
                </dmi2:Credentials>
               
            </dmi2:Data>
            <dmi2:Data ProtocolUri="http://www.oxygenxml.com/">
                <dmi2:DataUrl>http://www.oxygenxml.com/</dmi2:DataUrl>
                <dmi2:SrbURIProperties>
                    <dmi2:MdasDomainHome>MdasDomainHome1</dmi2:MdasDomainHome>
                    <dmi2:MdasCollectionHome>MdasCollectionHome1</dmi2:MdasCollectionHome>
                </dmi2:SrbURIProperties>
                <dmi2:Credentials>
                   
                </dmi2:Credentials>
               
            </dmi2:Data>
           
        </dmi2:Source>
        <dmi2:Sink>
            <dmi2:Data ProtocolUri="http://www.oxygenxml.com/">
                <dmi2:DataUrl>http://www.oxygenxml.com/</dmi2:DataUrl>
                <dmi2:IrodsURIProperties>
                    <dmi2:IrodsZone>IrodsZone2</dmi2:IrodsZone>
                </dmi2:IrodsURIProperties>
                <dmi2:Credentials>
                   
                </dmi2:Credentials>
                
            </dmi2:Data>
            <dmi2:Data ProtocolUri="http://www.oxygenxml.com/">
                <dmi2:DataUrl>http://www.oxygenxml.com/</dmi2:DataUrl>
                <dmi2:GridFtpURIProperties>
                </dmi2:GridFtpURIProperties>
                <dmi2:Credentials>
                  
                </dmi2:Credentials>
               
            </dmi2:Data>
           
        </dmi2:Sink>
      
    </dmi2:DataCopy>
</dmi2:BulkDataCopy>
